verse,ar,en,timestamps
83:1, وَيْلٌ لِّلْمُطَفِّفِينَ,"Woe to those who give less [than due],",0:00.382
83:2,ٱلَّذِينَ إِذَا ٱكْتَالُوا عَلَى ٱلنَّاسِ,"Who, when they take a measure from people,",0:03.294
,يَسْتَوْفُونَ,take in full.,0:06.573
83:3,وَإِذَا كَالُوهُمْ أَو وَّزَنُوهُمْ,"But if they give by measure or by weight to them,",0:07.914
,يُخْسِرُونَ,they cause loss.,0:11.053
83:4,أَلَا يَظُنُّ أُولَـٰٓئِكَ أَنَّهُم مَّبْعُوثُونَ,Do they not think that they will be resurrected,0:12.458
83:5,لِيَوْمٍ عَظِيمٍ,For a tremendous Day -,0:18.487
83:6,يَوْمَ يَقُومُ ٱلنَّاسُ لِرَبِّ ٱلْعَـٰلَمِينَ,The Day when mankind will stand before the Lord of the worlds?,0:20.258
,,,0:24.589
