verse,ar,en,timestamps
106:1, لِإِيلَـٰفِ قُرَيْشٍ,For the accustomed security of the Quraysh -,0:00.278
106:2,إِۦلَـٰفِهِمْ رِحْلَةَ ٱلشِّتَآءِ وَٱلصَّيْفِ,Their accustomed security [in] the caravan of winter and summer -,0:04.451
106:3,فَلْيَعْبُدُوا رَبَّ هَـٰذَا ٱلْبَيْتِ,"Let them worship the Lord of this House,",0:13.891
106:4,ٱلَّذِىٓ أَطْعَمَهُم مِّن جُوعٍ,"Who has fed them, [saving them] from hunger",0:19.532
,وَءَامَنَهُم مِّنْ خَوْفٍۭ,"and made them safe, [saving them] from fear.",0:27.080
,,,0:33.367
