verse,ar,en,timestamps
50:9,وَنَزَّلْنَا مِنَ ٱلسَّمَآءِ مَآءً مُّبَـٰرَكًا,And We have sent down blessed rain from the sky,0:04.112
,فَأَنۢبَتْنَا بِهِۦ جَنَّـٰتٍ وَحَبَّ ٱلْحَصِيدِ,and made grow thereby gardens and grain from the harvest,0:13.653
50:10,وَٱلنَّخْلَ بَاسِقَـٰتٍ لَّهَا طَلْعٌ نَّضِيدٌ,And lofty palm trees having fruit arranged in layers -,0:20.436
50:11,رِّزْقًا لِّلْعِبَادِ ۖ,"As provision for the servants,",0:26.213
,وَأَحْيَيْنَا بِهِۦ بَلْدَةً مَّيْتًا ۚ,and We have given life thereby to a dead land.,0:29.506
,كَذَٰلِكَ ٱلْخُرُوجُ,"Thus is the emergence [i.e., resurrection].",0:35.466
,,,0:38.793
